<?xml version="1.0" encoding="UTF-8"?>
<!-- RUNTIME CONFIG for tests run -->

<config xmlns:xsi="http://www.w3.org/2001/XMLSchema-instance" xsi:noNamespaceSchemaLocation="../Config.xsd">
    <server serverAddress="0.0.0.0" serverName="mage-server" port="17171" maxGameThreads="10" maxSecondsIdle="600"/>
    <playerTypes>
        <playerType name="Computer - mad" jar="mage-player-ai-mad.jar" className="mage.player.ai.ComputerPlayerControllableProxy"/>
        <playerType name="Computer - LLM" jar="mage-player-llm.jar" className="mage.player.llm.LLMPlayer"/>
        <playerType name="Computer - monte carlo" jar="mage-player-ai-mcts.jar" className="mage.player.ai.ComputerPlayerMCTS"/>
    </playerTypes>
    <gameTypes>
        <gameType name="Two Player Duel" jar="mage-game-twoplayerduel.jar" className="mage.game.TwoPlayerMatch" typeName="mage.game.TwoPlayerDuelType"/>
    </gameTypes>
    <tournamentTypes>
        <tournamentType name="Elimination Booster Draft" jar="mage-tournament-boosterdraft.jar" className="mage.tournament.BoosterDraftEliminationTournament" typeName="mage.tournament.BoosterDraftEliminationTournamentType"/>
    </tournamentTypes>
    <deckTypes>
        <deckType name="Constructed" jar="mage-deck-constructed.jar" className="mage.deck.Constructed"/>
        <deckType name="Limited" jar="mage-deck-limited.jar" className="mage.deck.Limited"/>
    </deckTypes>
</config>
